scripts/test/deltanet_sm86_sweep_results.json
{
  "gpu": "NVIDIA GeForce RTX 3090",
  "compute_capability": "sm_86",
  "model": "Qwen3.5-27B DeltaNet",
  "batch": 1,
  "tp": 2,
  "HV": 24,
  "H": 8,
  "K": 128,
  "V": 128,
  "deltanet_layers": 36,
  "results": [
    {
      "label": "baseline",
      "BV": 32,
      "num_warps": 1,
      "num_stages": 3,
      "grid_size": 96,
      "ms_per_layer": 0.0177,
      "ms_per_model": 0.6379,
      "tok_s": 1567.6,
      "speedup": 1.0,
      "correct": "PASS"
    },
    {
      "label": "BV32-w2",
      "BV": 32,
      "num_warps": 2,
      "num_stages": 3,
      "grid_size": 96,
      "ms_per_layer": 0.0148,
      "ms_per_model": 0.5331,
      "tok_s": 1875.8,
      "speedup": 1.197,
      "correct": "PASS"
    },
    {
      "label": "BV32-w4",
      "BV": 32,
      "num_warps": 4,
      "num_stages": 3,
      "grid_size": 96,
      "ms_per_layer": 0.0125,
      "ms_per_model": 0.4492,
      "tok_s": 2226.4,
      "speedup": 1.42,
      "correct": "PASS"
    },
    {
      "label": "BV32-s2",
      "BV": 32,
      "num_warps": 1,
      "num_stages": 2,
      "grid_size": 96,
      "ms_per_layer": 0.0151,
      "ms_per_model": 0.5428,
      "tok_s": 1842.2,
      "speedup": 1.175,
      "correct": "PASS"
    },
    {
      "label": "BV32-s1",
      "BV": 32,
      "num_warps": 1,
      "num_stages": 1,
      "grid_size": 96,
      "ms_per_layer": 0.0145,
      "ms_per_model": 0.5211,
      "tok_s": 1919.1,
      "speedup": 1.224,
      "correct": "PASS"
    },
    {
      "label": "BV32-w2-s2",
      "BV": 32,
      "num_warps": 2,
      "num_stages": 2,
      "grid_size": 96,
      "ms_per_layer": 0.0145,
      "ms_per_model": 0.5231,
      "tok_s": 1911.7,
      "speedup": 1.22,
      "correct": "PASS"
    },
    {
      "label": "BV32-w2-s1",
      "BV": 32,
      "num_warps": 2,
      "num_stages": 1,
      "grid_size": 96,
      "ms_per_layer": 0.014,
      "ms_per_model": 0.5028,
      "tok_s": 1988.9,
      "speedup": 1.269,
      "correct": "PASS"
    },
    {
      "label": "BV32-w4-s2",
      "BV": 32,
      "num_warps": 4,
      "num_stages": 2,
      "grid_size": 96,
      "ms_per_layer": 0.0146,
      "ms_per_model": 0.5248,
      "tok_s": 1905.4,
      "speedup": 1.216,
      "correct": "PASS"
    },
    {
      "label": "BV64-w1",
      "BV": 64,
      "num_warps": 1,
      "num_stages": 3,
      "grid_size": 48,
      "ms_per_layer": 0.0113,
      "ms_per_model": 0.4072,
      "tok_s": 2455.8,
      "speedup": 1.567,
      "correct": "PASS"
    },
    {
      "label": "BV64-w2",
      "BV": 64,
      "num_warps": 2,
      "num_stages": 3,
      "grid_size": 48,
      "ms_per_layer": 0.013,
      "ms_per_model": 0.468,
      "tok_s": 2136.8,
      "speedup": 1.363,
      "correct": "PASS"
    },
    {
      "label": "BV64-w2-s2",
      "BV": 64,
      "num_warps": 2,
      "num_stages": 2,
      "grid_size": 48,
      "ms_per_layer": 0.0143,
      "ms_per_model": 0.5159,
      "tok_s": 1938.3,
      "speedup": 1.237,
      "correct": "PASS"
    },
    {
      "label": "BV64-w4",
      "BV": 64,
      "num_warps": 4,
      "num_stages": 3,
      "grid_size": 48,
      "ms_per_layer": 0.0156,
      "ms_per_model": 0.5619,
      "tok_s": 1779.5,
      "speedup": 1.135,
      "correct": "PASS"
    },
    {
      "label": "BV64-w4-s2",
      "BV": 64,
      "num_warps": 4,
      "num_stages": 2,
      "grid_size": 48,
      "ms_per_layer": 0.0116,
      "ms_per_model": 0.4182,
      "tok_s": 2391.0,
      "speedup": 1.525,
      "correct": "PASS"
    },
    {
      "label": "BV64-w4-s1",
      "BV": 64,
      "num_warps": 4,
      "num_stages": 1,
      "grid_size": 48,
      "ms_per_layer": 0.012,
      "ms_per_model": 0.4317,
      "tok_s": 2316.5,
      "speedup": 1.478,
      "correct": "PASS"
    },
    {
      "label": "BV128-w4",
      "BV": 128,
      "num_warps": 4,
      "num_stages": 3,
      "grid_size": 24,
      "ms_per_layer": 0.0151,
      "ms_per_model": 0.5422,
      "tok_s": 1844.2,
      "speedup": 1.176,
      "correct": "PASS"
    },
    {
      "label": "BV128-w4-s2",
      "BV": 128,
      "num_warps": 4,
      "num_stages": 2,
      "grid_size": 24,
      "ms_per_layer": 0.012,
      "ms_per_model": 0.4304,
      "tok_s": 2323.6,
      "speedup": 1.482,
      "correct": "PASS"
    },
    {
      "label": "BV128-w4-s1",
      "BV": 128,
      "num_warps": 4,
      "num_stages": 1,
      "grid_size": 24,
      "ms_per_layer": 0.0151,
      "ms_per_model": 0.545,
      "tok_s": 1834.7,
      "speedup": 1.17,
      "correct": "PASS"
    },
    {
      "label": "BV128-w8-s2",
      "BV": 128,
      "num_warps": 8,
      "num_stages": 2,
      "grid_size": 24,
      "ms_per_layer": 0.0181,
      "ms_per_model": 0.6523,
      "tok_s": 1533.0,
      "speedup": 0.978,
      "correct": "PASS"
    },
    {
      "label": "BV128-w8-s1",
      "BV": 128,
      "num_warps": 8,
      "num_stages": 1,
      "grid_size": 24,
      "ms_per_layer": 0.014,
      "ms_per_model": 0.5043,
      "tok_s": 1983.0,
      "speedup": 1.265,
      "correct": "PASS"
    }
  ]
}